{
  "Cube": {
    "0.0": {
      "metrics": {
        "clean": {
          "mean": 66.66666666666667,
          "n": 3,
          "std": 2.6246692913372702,
          "values": [
            63.0,
            69.0,
            68.0
          ]
        },
        "goal_std0.03": {
          "mean": 61.0,
          "n": 3,
          "std": 1.4142135623730951,
          "values": [
            60.0,
            60.0,
            63.0
          ]
        },
        "goal_std0.05": {
          "mean": 48.333333333333336,
          "n": 3,
          "std": 6.018490028422596,
          "values": [
            54.0,
            40.0,
            51.0
          ]
        },
        "goal_std0.08": {
          "mean": 44.333333333333336,
          "n": 3,
          "std": 5.2493385826745405,
          "values": [
            49.0,
            37.0,
            47.0
          ]
        },
        "pixels_goal_std0.03": {
          "mean": 63.333333333333336,
          "n": 3,
          "std": 2.8674417556808756,
          "values": [
            63.0,
            60.0,
            67.0
          ]
        },
        "pixels_goal_std0.05": {
          "mean": 53.333333333333336,
          "n": 3,
          "std": 3.2998316455372185,
          "values": [
            51.0,
            51.0,
            57.99999999999999
          ]
        },
        "pixels_goal_std0.08": {
          "mean": 46.333333333333336,
          "n": 3,
          "std": 3.6817870057290873,
          "values": [
            46.0,
            42.0,
            51.0
          ]
        },
        "pixels_std0.03": {
          "mean": 63.666666666666664,
          "n": 3,
          "std": 4.642796092394707,
          "values": [
            59.0,
            70.0,
            62.0
          ]
        },
        "pixels_std0.05": {
          "mean": 48.666666666666664,
          "n": 3,
          "std": 6.847546194724712,
          "values": [
            53.0,
            39.0,
            54.0
          ]
        },
        "pixels_std0.08": {
          "mean": 47.0,
          "n": 3,
          "std": 6.377042156569663,
          "values": [
            52.0,
            38.0,
            51.0
          ]
        }
      },
      "path": "/home/ag/dataset/ag_data/data/world_model/quentinll/lewm-cube/ckpt/cube_lewm_20260430",
      "subdir": "cube_lewm_20260430"
    },
    "0.01": {
      "metrics": {
        "clean": {
          "mean": 69.33333333333333,
          "n": 3,
          "std": 0.4714045207910317,
          "values": [
            69.0,
            69.0,
            70.0
          ]
        },
        "goal_std0.03": {
          "mean": 65.33333333333333,
          "n": 3,
          "std": 2.6246692913372702,
          "values": [
            63.0,
            69.0,
            64.0
          ]
        },
        "goal_std0.05": {
          "mean": 61.333333333333336,
          "n": 3,
          "std": 2.6246692913372702,
          "values": [
            60.0,
            59.0,
            65.0
          ]
        },
        "goal_std0.08": {
          "mean": 47.666666666666664,
          "n": 3,
          "std": 3.39934634239519,
          "values": [
            49.0,
            43.0,
            51.0
          ]
        },
        "pixels_goal_std0.03": {
          "mean": 67.66666666666667,
          "n": 3,
          "std": 3.858612300930075,
          "values": [
            66.0,
            73.0,
            64.0
          ]
        },
        "pixels_goal_std0.05": {
          "mean": 60.333333333333336,
          "n": 3,
          "std": 1.247219128924647,
          "values": [
            62.0,
            60.0,
            59.0
          ]
        },
        "pixels_goal_std0.08": {
          "mean": 51.333333333333336,
          "n": 3,
          "std": 5.792715732327589,
          "values": [
            50.0,
            45.0,
            59.0
          ]
        },
        "pixels_std0.03": {
          "mean": 70.0,
          "n": 3,
          "std": 3.7416573867739413,
          "values": [
            71.0,
            74.0,
            65.0
          ]
        },
        "pixels_std0.05": {
          "mean": 70.66666666666667,
          "n": 3,
          "std": 0.4714045207910317,
          "values": [
            70.0,
            71.0,
            71.0
          ]
        },
        "pixels_std0.08": {
          "mean": 49.0,
          "n": 3,
          "std": 2.449489742783178,
          "values": [
            52.0,
            46.0,
            49.0
          ]
        }
      },
      "path": "/home/ag/dataset/ag_data/data/world_model/quentinll/lewm-cube/ckpt/cube_lewm_noise_0to001_p1",
      "subdir": "cube_lewm_noise_0to001_p1"
    },
    "0.02": {
      "metrics": {
        "clean": {
          "mean": 60.0,
          "n": 3,
          "std": 1.632993161855455,
          "values": [
            60.0,
            57.99999999999999,
            62.0
          ]
        },
        "goal_std0.03": {
          "mean": 58.0,
          "n": 3,
          "std": 0.8164965809277289,
          "values": [
            59.0,
            56.99999999999999,
            57.99999999999999
          ]
        },
        "goal_std0.05": {
          "mean": 58.666666666666664,
          "n": 3,
          "std": 3.299831645537222,
          "values": [
            61.0,
            54.0,
            61.0
          ]
        },
        "goal_std0.08": {
          "mean": 60.666666666666664,
          "n": 3,
          "std": 1.699673171197595,
          "values": [
            59.0,
            60.0,
            63.0
          ]
        },
        "pixels_goal_std0.03": {
          "mean": 60.666666666666664,
          "n": 3,
          "std": 3.0912061651652367,
          "values": [
            59.0,
            57.99999999999999,
            65.0
          ]
        },
        "pixels_goal_std0.05": {
          "mean": 60.0,
          "n": 3,
          "std": 1.4142135623730951,
          "values": [
            59.0,
            59.0,
            62.0
          ]
        },
        "pixels_goal_std0.08": {
          "mean": 60.666666666666664,
          "n": 3,
          "std": 0.4714045207910317,
          "values": [
            61.0,
            60.0,
            61.0
          ]
        },
        "pixels_std0.03": {
          "mean": 56.666666666666664,
          "n": 3,
          "std": 3.0912061651652336,
          "values": [
            55.00000000000001,
            54.0,
            61.0
          ]
        },
        "pixels_std0.05": {
          "mean": 60.666666666666664,
          "n": 3,
          "std": 1.247219128924647,
          "values": [
            62.0,
            59.0,
            61.0
          ]
        },
        "pixels_std0.08": {
          "mean": 58.666666666666664,
          "n": 3,
          "std": 3.299831645537222,
          "values": [
            61.0,
            54.0,
            61.0
          ]
        }
      },
      "path": "/home/ag/dataset/ag_data/data/world_model/quentinll/lewm-cube/ckpt/cube_lewm_noise_0to002_p1",
      "subdir": "cube_lewm_noise_0to002_p1"
    },
    "0.03": {
      "metrics": {
        "clean": {
          "mean": 65.0,
          "n": 3,
          "std": 1.632993161855452,
          "values": [
            63.0,
            65.0,
            67.0
          ]
        },
        "goal_std0.03": {
          "mean": 67.33333333333333,
          "n": 3,
          "std": 0.4714045207910317,
          "values": [
            68.0,
            67.0,
            67.0
          ]
        },
        "goal_std0.05": {
          "mean": 65.66666666666667,
          "n": 3,
          "std": 3.39934634239519,
          "values": [
            67.0,
            61.0,
            69.0
          ]
        },
        "goal_std0.08": {
          "mean": 67.33333333333333,
          "n": 3,
          "std": 3.39934634239519,
          "values": [
            66.0,
            72.0,
            64.0
          ]
        },
        "pixels_goal_std0.03": {
          "mean": 69.66666666666667,
          "n": 3,
          "std": 3.2998316455372216,
          "values": [
            69.0,
            74.0,
            66.0
          ]
        },
        "pixels_goal_std0.05": {
          "mean": 66.66666666666667,
          "n": 3,
          "std": 2.0548046676563256,
          "values": [
            67.0,
            64.0,
            69.0
          ]
        },
        "pixels_goal_std0.08": {
          "mean": 67.33333333333333,
          "n": 3,
          "std": 1.8856180831641267,
          "values": [
            66.0,
            70.0,
            66.0
          ]
        },
        "pixels_std0.03": {
          "mean": 67.66666666666667,
          "n": 3,
          "std": 1.247219128924647,
          "values": [
            69.0,
            66.0,
            68.0
          ]
        },
        "pixels_std0.05": {
          "mean": 66.66666666666667,
          "n": 3,
          "std": 2.357022603955158,
          "values": [
            65.0,
            70.0,
            65.0
          ]
        },
        "pixels_std0.08": {
          "mean": 68.33333333333333,
          "n": 3,
          "std": 2.494438257849294,
          "values": [
            65.0,
            71.0,
            69.0
          ]
        }
      },
      "path": "/home/ag/dataset/ag_data/data/world_model/quentinll/lewm-cube/ckpt/cube_lewm_noise_0to003_p1",
      "subdir": "cube_lewm_noise_0to003_p1"
    },
    "0.04": {
      "metrics": {
        "clean": {
          "mean": 69.0,
          "n": 3,
          "std": 3.7416573867739413,
          "values": [
            68.0,
            74.0,
            65.0
          ]
        },
        "goal_std0.03": {
          "mean": 65.66666666666667,
          "n": 3,
          "std": 1.699673171197595,
          "values": [
            65.0,
            68.0,
            64.0
          ]
        },
        "goal_std0.05": {